ad_id,title,location_raw,district,neighborhood,road_type,raw_price,land_size_aana,price_per_aana,calculated_total_price,is_price_suspect,is_price_outlier,is_rate_outlier,is_large_plot
HB-02BB51,Land for Sale at Lazimpat,"लाजिम्पाट सडक, नारायण टोल, महाराजगंज, Kathmandu-26, काठमाडौं, काठमाडौँ महानगरपालिका, काठमाडौं, बाग्मती प्रदेश, 14600, नेपाल",Kathmandu,लाजिम्पाट सडक,Above 20 Ft,2000000.0,6.0,2000000.0,12000000.0,False,False,False,False
HB-9E0490,Land for sale Baluwatar chundavi 15anna,"Chudevi Multitech, Chundevi Ganesh Marg, चुनदेवी, चप्पल कारखाना, Kathmandu-04, काठमाडौं, काठमाडौँ महानगरपालिका, काठमाडौं, बाग्मती प्रदेश, 44606, नेपाल",Kathmandu,Chudevi Multitech,13-20 Ft,7500000.0,15.0,7500000.0,112500000.0,False,False,False,False
HB-5B4B94,22 Aana Land 2 Storey New House Free On Sale,"Budhanilkantha, Budhanilkantha Municipality, Kathmandu",Kathmandu,Budhanilkantha,,90000000.0,11.68736303871439,7700625.0,90000000.0,False,False,False,False
HB-2083C8,"Land on sell at Valley Public school,Kathmandu","bangal, Bhangal (Budhanilkantha), Kathmandu",Kathmandu,Bangal,Above 20 Ft,4500000.0,6.0,4500000.0,27000000.0,False,False,False,False
HB-9A05BB,"Land on sell at Budhanilkantha,Kathmandu","budanilkantha, Budhanilkantha, Kathmandu",Kathmandu,Budhanilkantha,Pitched Road,95000000.0,20.5,4634146.341463415,95000000.0,False,False,False,False
HB-A66A80,"Land on sell at Baluwatar,Kathmandu","Baluwatar, Kathmandu",Kathmandu,Baluwatar,Pitched Road,9500000.0,7.25,1310344.8275862068,9500000.0,False,False,False,False
HB-C87595,"1 Ropani Land on sale in Sidhartha, Budhanilkantha","budanilkantha, Budhanilkantha, Kathmandu",Kathmandu,Budhanilkantha,Gravel Road,4500000.0,16.0,4500000.0,72000000.0,False,False,False,False
HB-B0877C,"8 ana Land on sale in Budhanilkantha, 18ft Road","budanilkantha, Budhanilkantha, Kathmandu",Kathmandu,Budhanilkantha,Pitched Road,5200000.0,8.0,5200000.0,41600000.0,False,False,False,False
HB-33C654,10 Aana land for sale house free manbhawan,"Manbhawan (Kumaripati), Lalitpur",Lalitpur,Manbhawan,,85000000.0,10.0,8500000.0,85000000.0,False,False,False,False
HB-918A7D,Land for sale in hattigauda,"budanilkantha, Hattigaunda (Budhanilkantha), Kathmandu",Kathmandu,Budhanilkantha,Gravel Road,4200000.0,6.0,4200000.0,25200000.0,False,False,False,False
HB-068771,Land for sale in budhanilkantha,"budanilkantha, Budhanilkantha, Kathmandu",Kathmandu,Budhanilkantha,Pitched Road,5200000.0,6.0,5200000.0,31200000.0,False,False,False,False
HB-271BD3,"4 aana 1 Dam land -Sale - Dhapakhel, Lalitpur","Dhapakhel, Lalitpur",Lalitpur,Dhapakhel,,4500000.0,4.0,1125000.0,4500000.0,False,False,False,False
HB-10D606,3 AANA LAND ON SALE IN CHANGUNARAYAN,"Duwakot (Changunarayan), Bhaktapur",Bhaktapur,Duwakot,,1800000.0,3.0,1800000.0,5400000.0,False,False,False,False
HB-C0C7FA,"4 ana land for sale in Harisiddhi , Lalitpur","Harisiddhi, Lalitpur",Lalitpur,Harisiddhi,,2400000.0,4.0,2400000.0,9600000.0,False,False,False,False
HB-C47D5E,"7 aana land for sale at Nakhudol, Lalitpur","nakkhudole, Nakhudole (Bhaisepati), Lalitpur",Lalitpur,Nakkhudole,,4500000.0,7.0,4500000.0,31500000.0,False,False,False,False
HB-0E769C,6 AANA 1 PAISA LAND FOR SALE IN DHAPAKHEL HEIGHT,"Dhapakhel, Lalitpur",Lalitpur,Dhapakhel,,4000000.0,6.0,4000000.0,24000000.0,False,False,False,False
HB-F16F69,"6 aana Residential land Sale at Kritipur, Kathmand","kritipur kritipur, Kirtipur (Kritipur), Kathmandu",Kathmandu,Kirtipur,,2950000.0,6.0,2950000.0,17700000.0,False,False,False,False
HB-695AE5,4 AANA 2 DAM LAND FOR SALE IN DHAPAKHEL HEIGHT,"Dhapakhel, Lalitpur",Lalitpur,Dhapakhel,,4000000.0,4.0,1000000.0,4000000.0,False,False,False,False
HB-BDE90F,7 AANA IN HARISIDDHI; LAND FOR SALE,"Harisiddhi, Lalitpur",Lalitpur,Harisiddhi,,4500000.0,19.0,4500000.0,85500000.0,False,False,False,False
HB-1569B8,"6 ana Land on sale in Bhangal,Budhanilkantha- 26ft","bangal, Bhangal (Budhanilkantha), Kathmandu",Kathmandu,Bangal,Gravel Road,5000000.0,6.0,5000000.0,30000000.0,False,False,False,False
HB-4D8402,"Land on Sale at Kattike Nagarkot, GJBLOS 2888","Nagarkot, Bhaktapur",Bhaktapur,Nagarkot,Pitched Road,1200000.0,32.0,1200000.0,38400000.0,False,False,False,False
HB-A42F7C,Imadol Ochu Height 12 anna Land Sale,"Imadol (Mahalaxmi), Lalitpur",Lalitpur,Imadol,Pitched Road,4990000.0,12.0,4990000.0,59880000.0,False,False,False,False
HB-E0FB44,7 Aana residence land for sale jhamsikhel,"jamsikhel, Jhamsikhel, Lalitpur",Lalitpur,Jhamsikhel,,9500000.0,7.0,1357142.857142857,9500000.0,False,False,False,False
HB-6BA804,4.5 AANA IN GODAWARI FOR SALE AT BISTACHHAP,"Bistachap (Godawari), Lalitpur",Lalitpur,Godawari,,2000000.0,4.4996347699050405,2000000.0000000002,8999269.539810082,False,False,False,False
HB-98B8C2,4 aana land -Sale - Kapan nearby Ram Mandir,"Baluwakhani (Kapan), Kathmandu",Kathmandu,Kapan,,4000000.0,4.0,1000000.0,4000000.0,False,False,False,False
HB-700DF0,7 Ropani Step-Step Slope land on Sale in Golfutar,"Golfutar (Budhanilkantha), Kathmandu",Kathmandu,Budhanilkantha,Pitched Road,246400000.0,112.0,2200000.0,246400000.0,False,False,False,True
HB-11B21A,2 Ropani 6 anna Jagga at Sakhu 80m from Roadside,"Suntol road, Shankharapur-06, Shankharapur, काठमाडौं, बाग्मती प्रदेश, नेपाल",Kathmandu,Shankharapur,Above 20 Ft,1800000.0,32.0,1800000.0,57600000.0,False,False,False,False
HB-A70891,"Land on Sale Grande Housing Backside,GJBLOS 3422","Tokha Saraswati (Tokha), Kathmandu",Kathmandu,Tokha,Gravel Road,3500000.0,3.5625,3500000.0,12468750.0,False,False,False,False
HB-969D17,11 Ana Land For Sale At Dhumbarai Kathmandu,"730/30, Pawan Galli, Anandanagar, Dhumbarahi, Kathmandu, Kathmandu Metropolitan City, Kathmandu",Kathmandu,Pawan Galli,13-20 Ft,6500000.0,11.0,6500000.0,71500000.0,False,False,False,False
HB-0D0911,35 Ana Land For Sale At Budhanilkantha Pasikot,"Budhanilkantha, Budhanilkantha Municipality, Kathmandu",Kathmandu,Budhanilkantha,13-20 Ft,2700000.0,35.0,2700000.0,94500000.0,False,False,False,False
HB-232A41,11 Ana Land With House For Sale At Budhanilkantha,"Budhanilkantha, Budhanilkantha Municipality, Kathmandu",Kathmandu,Budhanilkantha,13-20 Ft,86500000.0,11.0,7863636.363636363,86500000.0,False,False,False,False
HB-51014C,7.5Ana Land For Sale At Budhanilkantha Rudreshwore,"Budhanilkantha, Budhanilkantha Municipality, Kathmandu",Kathmandu,Budhanilkantha,Above 20 Ft,4300000.0,6.0,4300000.0,25800000.0,False,False,False,False
HB-CA9D42,2 Ropani 8 ana land on sale in Budhanilkantha,"budanilkantha, Budhanilkantha, Kathmandu",Kathmandu,Budhanilkantha,Pitched Road,5000000.0,40.0,5000000.0,200000000.0,False,False,False,False
HB-5445FE,3.5Ana Land For Sale At Budhanilkantha Isan Colony,"Budhanilkantha, Budhanilkantha Municipality, Kathmandu",Kathmandu,Budhanilkantha,13-20 Ft,4200000.0,4.0,1050000.0,4200000.0,False,False,False,False
HB-840333,6 Ana Land For Sale At Budhanilkantha Talung,"Budhanilkantha, Budhanilkantha Municipality, Kathmandu",Kathmandu,Budhanilkantha,Above 20 Ft,5000000.0,6.0,5000000.0,30000000.0,False,False,False,False
HB-A804A0,22 ana Land on sale in Budhanilkantha Height,"budanilkantha, Budhanilkantha, Kathmandu",Kathmandu,Budhanilkantha,Gravel Road,3700000.0,22.0,3700000.0,81400000.0,False,False,False,False
HB-2A06D6,"3 Ropani land -Sale - Ramkot, Nagarjun","Ramkot (Nagarjun), Kathmandu",Kathmandu,Nagarjun,,2500000.0,48.0,2500000.0,120000000.0,False,False,False,False
HB-E7D18B,"8 aana land -Sale - Ramkot, Nagarjun","Ramkot (Nagarjun), Kathmandu",Kathmandu,Nagarjun,,4000000.0,8.0,4000000.0,32000000.0,False,False,False,False
HB-F88F95,"13 aana land -Sale - Ramkot, Nagarjun","Ramkot (Nagarjun), Kathmandu",Kathmandu,Nagarjun,Above 20 Ft,3000000.0,13.0,3000000.0,39000000.0,False,False,False,False
HB-894ACF,7aana 2paisa land Sale 300Mtr from Kalanki Highway,"Kalanki, Kathmandu",Kathmandu,Kalanki,,6300000.0,7.0,6300000.0,44100000.0,False,False,False,False
HB-E3275D,1 Ropani Land with House on sale in Budhanilkantha,"budanilkantha, Budhanilkantha, Kathmandu",Kathmandu,Budhanilkantha,Gravel Road,82500000.0,16.0,5156250.0,82500000.0,False,False,False,False
HB-872458,"4 Ropani land with House on sale in Lele, Lalitpur","Lele (Bajrabarahi), Lalitpur",Lalitpur,Lele,Above 20 Ft,102400000.0,64.0,1600000.0,102400000.0,False,False,False,True
HB-9645F6,"40Aana Land on sale at Sankhamul (Baneshwor), KTM","new baneshwar naya baneswor sankhamul, Shankhamul (New Baneshwor), Kathmandu",Kathmandu,Baneshwar,Pitched Road,6800000.0,40.0,6800000.0,272000000.0,False,False,False,False
HB-0C02AB,Land for Sale in Harisiddi 9aana,"Harisiddhi, Lalitpur",Lalitpur,Harisiddhi,,3200000.0,9.0,3200000.0,28800000.0,False,False,False,False
HB-F05910,Land for Sale in Harisiddi 3aana 2dam,"Harisiddhi, Lalitpur",Lalitpur,Harisiddhi,,3500000.0,3.0,1166666.6666666667,3500000.0,False,False,False,False
HB-38DCC7,12 anna land at highway budhanilkantha ganeshchowk,"गोल्फुटार, Budhanilkantha-08, बूढानीलकण्ठ, बूढानिलकण्ठ नगरपालिका, काठमाडौं, बाग्मती प्रदेश, 22644, नेपाल",Kathmandu,गोल्फुटार,Above 20 Ft,5900000.0,12.0,5900000.0,70800000.0,False,False,False,False
HB-B1F7CC,12 anna Jagga tokha phulbari only at 12 lakh\anna,"NH40, टोखा चण्डेश्वरि, Tokha-02, टोखा सरस्वती, टोखा नगरपालिका, काठमाडौं, बाग्मती प्रदेश, 44608, नेपाल",Kathmandu,टोखा चण्डेश्वरि,Above 20 Ft,1200000.0,12.0,1200000.0,14400000.0,False,False,False,False
HB-264A5C,4 anna jagga at tokha phulbari 20ft roadside land,"NH40, टोखा चण्डेश्वरि, Tokha-02, टोखा सरस्वती, टोखा नगरपालिका, काठमाडौं, बाग्मती प्रदेश, 44608, नेपाल",Kathmandu,टोखा चण्डेश्वरि,Above 20 Ft,2000000.0,4.0,2000000.0,8000000.0,False,False,False,False
HB-676AA7,9 anna Jagga at Budhanilkantha pasikot roadside,"खड्कागाउँ, Budhanilkantha-04, बूढानीलकण्ठ, बूढानिलकण्ठ नगरपालिका, काठमाडौं, बाग्मती प्रदेश, 22644, नेपाल",Kathmandu,खड्कागाउँ,13-20 Ft,4500000.0,9.0,4500000.0,40500000.0,False,False,False,False
HB-82C758,"Land on sell at Sankhu,Kathmandu","Sankhu (Shankharapur), Kathmandu",Kathmandu,Sankhu,Above 20 Ft,1100000.0,272.0,1100000.0,299200000.0,False,False,False,True
HB-80B4B6,Jagga at Budhanilkantha 2 ropani land roadside,"खड्कागाउँ, Budhanilkantha-04, बूढानीलकण्ठ, बूढानिलकण्ठ नगरपालिका, काठमाडौं, बाग्मती प्रदेश, 22644, नेपाल",Kathmandu,खड्कागाउँ,Above 20 Ft,4500000.0,32.0,4500000.0,144000000.0,False,False,False,False
HB-A7ADCB,Jagga at pasikot 6.5 anna land roadside,"खड्कागाउँ, Budhanilkantha-04, बूढानीलकण्ठ, बूढानिलकण्ठ नगरपालिका, काठमाडौं, बाग्मती प्रदेश, 22644, नेपाल",Kathmandu,खड्कागाउँ,13-20 Ft,4700000.0,6.5,4700000.0,30550000.0,False,False,False,False
HB-7DD86A,Jagga at pasikot 6 anna land roadside,"खड्कागाउँ, Budhanilkantha-04, बूढानीलकण्ठ, बूढानिलकण्ठ नगरपालिका, काठमाडौं, बाग्मती प्रदेश, 40607, नेपाल",Kathmandu,खड्कागाउँ,13-20 Ft,5000000.0,6.0,5000000.0,30000000.0,False,False,False,False
HB-CB6EA7,8 anna at road side of pasikot,"खड्कागाउँ, Budhanilkantha-04, बूढानीलकण्ठ, बूढानिलकण्ठ नगरपालिका, काठमाडौं, बाग्मती प्रदेश, 22644, नेपाल",Kathmandu,खड्कागाउँ,Above 20 Ft,4500000.0,8.0,4500000.0,36000000.0,False,False,False,False
HB-4659B4,5 anna land at Budhanilkantha,"Budhanilkantha-02, बूढानीलकण्ठ, बूढानिलकण्ठ नगरपालिका, काठमाडौं, बाग्मती प्रदेश, 22644, नेपाल",Kathmandu,Budhanilkantha,13-20 Ft,2500000.0,5.0,2500000.0,12500000.0,False,False,False,False
HB-2C6C3C,10 anna Land on sell at pasikot,"Tokha-03, टोखा सरस्वती, टोखा नगरपालिका, काठमाडौं, बाग्मती प्रदेश, 44608, नेपाल",Kathmandu,Tokha,13-20 Ft,2300000.0,10.0,2300000.0,23000000.0,False,False,False,False
HB-BCEE9B,6 Anna Jagga Buddhanilkantha Near bishnumati pool,"दुलाल टोल, Budhanilkantha-05, बूढानीलकण्ठ, बूढानिलकण्ठ नगरपालिका, काठमाडौं, बाग्मती प्रदेश, 22644, नेपाल",Kathmandu,दुलाल टोल,13-20 Ft,2600000.0,6.0,2600000.0,15600000.0,False,False,False,False
HB-9D347D,8 anna land Budhanilkantha near lemon tree hotel,"Budhanilkantha-01, बूढानीलकण्ठ, बूढानिलकण्ठ नगरपालिका, काठमाडौं, बाग्मती प्रदेश, 22644, नेपाल",Kathmandu,Budhanilkantha,13-20 Ft,2500000.0,8.0,2500000.0,20000000.0,False,False,False,False
HB-22CCD4,5 anna land at Buddhanilkantha,"Budhanilkantha Bagaicha, Budhanilkantha-01, बूढानीलकण्ठ, बूढानिलकण्ठ नगरपालिका, काठमाडौं, बाग्मती प्रदेश, 22644, नेपाल",Kathmandu,Budhanilkantha,13-20 Ft,2500000.0,5.0,2500000.0,12500000.0,False,False,False,False
HB-43E651,West Facing 4 Aana Land On Sale At Baluwatar,"40, Pandol Marg, Panipokhari, Kathmandu, Kathmandu Metropolitan City, Kathmandu",Kathmandu,Panipokhari,13-20 Ft,36000000.0,4.0,9000000.0,36000000.0,False,False,False,False
HB-9BCD64,"3 aana land for Sale at Syuchatar, Kalanki !!","suchatar, Syuchatar (Kalanki), Kathmandu",Kathmandu,Suchatar,Pitched Road,4000000.0,3.0,1333333.3333333333,4000000.0,False,False,False,False
HB-604A5C,"12 ana Land on sale in Rudreshwor, Budhanilkantha","budanilkantha, Budhanilkantha, Kathmandu",Kathmandu,Budhanilkantha,Pitched Road,6000000.0,12.0,6000000.0,72000000.0,False,False,False,False
HB-E9D123,Land Sell,"Sammunat Nepal, 27DR033, Gokarneshwar-01, Mulkharka, गोकर्णेश्वर नगरपालिका, काठमाडौं, बाग्मती प्रदेश, 44603, नेपाल",Kathmandu,Gokarneshwar,13-20 Ft,2400000.0,4.0,2400000.0,9600000.0,False,False,False,False
HB-5D6DDA,Land Sell,"Sammunat Nepal, 27DR033, Gokarneshwar-01, Mulkharka, गोकर्णेश्वर नगरपालिका, काठमाडौं, बाग्मती प्रदेश, 44603, नेपाल",Kathmandu,Gokarneshwar,13-20 Ft,6800000.0,4.0,1700000.0,6800000.0,False,False,False,False
HB-FD7323,Land for sale in Italitar,"ithalitar budanilkantha, Italitar (Budhanilkantha), Kathmandu",Kathmandu,Thali,Pitched Road,4200000.0,9.0,4200000.0,37800000.0,False,False,False,False
HB-881EBF,Land for sale in naxal,"Naxal, Kathmandu",Kathmandu,Naxal,Pitched Road,10000000.0,14.0,10000000.0,140000000.0,False,False,False,False
HB-BF683E,4 AANA 2 PAISA LAND FOR SALE IN IMADOL,"Imadol Tikathali Siddhipur Sanagau Mahalaxmisthan Lubhu Lamatar Changathali, Mahalaxmi Area, Lalitpur",Lalitpur,Imadol,,4500000.0,4.0,1125000.0,4500000.0,False,False,False,False
HB-7D81AA,🏡 Land On Sale at Budhanilkantha🌳,"budanilkantha, Budhanilkantha, Kathmandu",Kathmandu,Budhanilkantha,Pitched Road,5500000.0,4.0,1375000.0,5500000.0,False,False,False,False
HB-263ED3,Land on sell at Lazimpat kathmandu,"lajimpat, Lazimpat, Kathmandu",Kathmandu,Lajimpat,Pitched Road,6000000.0,12.0,6000000.0,72000000.0,False,False,False,False
HB-8CAC39,"Land on sell at Dhumbharai , kathmandu","dumbarahi, Dhumbarahi, Kathmandu",Kathmandu,Dumbarahi,Pitched Road,9000000.0,9.0,1000000.0,9000000.0,False,False,False,False
HB-302374,"Land on sell at Naxal,Kathmanu","Naxal, Kathmandu",Kathmandu,Naxal,Pitched Road,10000000.0,15.0,10000000.0,150000000.0,False,False,False,False
HB-B324B2,"Land on sell at Naxal,Kathmandu","Naxal, Kathmandu",Kathmandu,Naxal,Pitched Road,10000000.0,17.0,10000000.0,170000000.0,False,False,False,False
HB-8B9238,"Land on sell at chandol,kathmandu","Chandol, Kathmandu",Kathmandu,Chandol,Pitched Road,8000000.0,32.0,8000000.0,256000000.0,False,False,False,False
HB-24EAAA,"4 aana 1 paisa land is ""FOR SALE"" at Kavresthali.","All Core Kathmandu, Kathmandu",Kathmandu,All Core Kathmandu,Above 20 Ft,3600000.0,4.0,3600000.0,14400000.0,False,False,False,False
HB-FBEF4C,"५ आना जग्गा बिक्रीमा रानीबनमा KTM, ५ Aana sale","Nagarjun-01, नागार्जुन नगरपालिका, काठमाडौं, बाग्मती प्रदेश, 44601, नेपाल",Kathmandu,Nagarjun,13-20 Ft,5100000.0,5.0,1020000.0,5100000.0,False,False,False,False
HB-0E0212,land on sale,"Mulpani (Kageshwor), Kathmandu",Kathmandu,Mulpani,Pitched Road,19000000.0,4.3,4418604.651162791,19000000.0,False,False,False,False
HB-6F556A,1 Ropani Land on sale in Budhanilkantha Height,"budanilkantha, Budhanilkantha, Kathmandu",Kathmandu,Budhanilkantha,Gravel Road,3800000.0,16.0,3800000.0,60800000.0,False,False,False,False
HB-3E2B8B,Maharajgunj Ma 24 Aana Jagga Ghar Bikrima,"Maharajganj Sadak, Narayan Gopal Chowk, Maharajganj, Kathmandu, Kathmandu Metropolitan City, Kathmandu",Kathmandu,Maharajganj Sadak,13-20 Ft,8500000.0,24.0,8500000.0,204000000.0,False,False,False,False
HB-07DF62,3 Ropani land with Trees on sale in Budhanilkantha,"budanilkantha, Budhanilkantha, Kathmandu",Kathmandu,Budhanilkantha,Pitched Road,8500000.0,48.0,8500000.0,408000000.0,False,False,False,False
HB-5816E9,Champi Land For Sale,"Dukuchhap, Godawari, Lalitpur",Lalitpur,Dukuchhap,13-20 Ft,1175000.0,5.0,1175000.0,5875000.0,False,False,False,False
HB-0F05E9,"Land on sale at Basundhara (Dhaarapati), Kathmandu","vasundhara, Basundhara, Kathmandu",Kathmandu,Vasundhara,Pitched Road,6000000.0,15.5,6000000.0,93000000.0,False,False,False,False
HB-600B8C,Land for Sale at Kumaripati,"Manbhawan Patan Hospital Lagankhel Jawalakhel, Kumaripati Area, Lalitpur",Lalitpur,Kumaripati,Pitched Road,165000000.0,11.0,15000000.0,165000000.0,False,False,False,False
HB-557747,Land for sale in Budhanilkantha,"budanilkantha, Budhanilkantha, Kathmandu",Kathmandu,Budhanilkantha,Pitched Road,5000000.0,12.0,5000000.0,60000000.0,False,False,False,False
HB-C6118A,4.5 aana Land for Sale in Special Chowk,"budanilkantha, Budhanilkantha, Kathmandu",Kathmandu,Budhanilkantha,,4000000.0,4.5,4000000.0,18000000.0,False,False,False,False
HB-881952,22 Ropani land on sale at Dakshinkali Nagarpalika,"27DR003, Pharping, Dakshinkali-06, Dakshinkali, दक्षि‍णकाली नगरपालिका, काठमाडौं, बाग्मती प्रदेश, नेपाल",Kathmandu,Pharping,,250000.0,352.0,250000.0,88000000.0,False,False,True,True
HB-5E31B2,3/4and 5 aana land plot for sale-Dryport Kirtipur,"kritipur kritipur, Kirtipur (Kritipur), Kathmandu",Kathmandu,Kirtipur,Gravel Road,2650000.0,26.5,2650000.0,70225000.0,False,False,False,False
HB-3874C9,"Land on sale at Chandol (Panchakanya), Kathmandu","Chandol, Kathmandu",Kathmandu,Chandol,Pitched Road,7500000.0,4.0,1875000.0,7500000.0,False,False,False,False
HB-7E363E,VARIOUS PLOTS FOR SALE IN FARSIDOL,"Dakshinkali, Kathmandu",Kathmandu,Dakshinkali,,1600000.0,16.0,1600000.0,25600000.0,False,False,False,False
HB-C2BE3B,10.5 Aana land sale tokha 700 from grande hospital,"Tokha, Kathmandu",Kathmandu,Tokha,,4000000.0,10.5,4000000.0,42000000.0,False,False,False,False
HB-F1AA21,4 Aana Land On Sale At Pashupatinath Area,"Mitrapark Area, Kathmandu",Kathmandu,Mitrapark,9-12 Ft,10000000.0,4.0,2500000.0,10000000.0,False,False,False,False
HB-30BFA0,5 AANA 3 PAISA LAND FOR SALE IN CHAPAGAUN,"Chapagaun (Bajrabarahi), Lalitpur",Lalitpur,Chapagaun,,3000000.0,5.0,3000000.0,15000000.0,False,False,False,False
HB-AF342C,"Land on sell at Gairidhara,Kathmandu","gairedhara gharidhara, Gairidhara, Kathmandu",Kathmandu,Gairedhara Gharidhara,Pitched Road,7000000.0,5.0,1400000.0,7000000.0,False,False,False,False
HB-DD7BD8,"Land on sell Dachi,Kathmandu","Thali (Kageshwor), Kathmandu",Kathmandu,Thali,Pitched Road,1300000.0,336.0,1300000.0,436800000.0,False,False,False,True
HB-650771,"7 aana Land for Sale at Chandragiri, Kathmandu","chandagiri, Chandragiri, Kathmandu",Kathmandu,Chandagiri,,2800000.0,7.0,2800000.0,19600000.0,False,False,False,False
HB-3D15A1,Land For Sale at Chakupat,"Jwagal Bakhundole Bhakundole Chakupat Pulchowk Sanepa Kupandol kopondole, Kupondole Area, Lalitpur",Lalitpur,Sanepa,Pitched Road,61500000.0,7.3,8424657.534246575,61500000.0,False,False,False,False
HB-4816D8,1 Ropani Land on sale in Budhanilkantha Height,"budanilkantha, Budhanilkantha, Kathmandu",Kathmandu,Budhanilkantha,Gravel Road,4300000.0,15.75,4300000.0,67725000.0,False,False,False,False
HB-4BE66A,"Planning Land on Sale at Chapagaun, GJBLOS 3100","Chapagaun (Bajrabarahi), Lalitpur",Lalitpur,Chapagaun,Pitched Road,2000000.0,4.4375,2000000.0,8875000.0,False,False,False,False
HB-BB8BAD,"Land on sale in Sankata Homes, Sitapaila.","All Outskirt Kathmandu, Kathmandu",Kathmandu,All Outskirt Kathmandu,,3850000.0,3.488677867056245,1103569.932998325,3850000.0,False,False,False,False
HB-1FE48B,Suryabinayak Ganesthan road Land sale,"Ghalate, Suryabinayak-06, Suryabinayak, सूर्यविनायक नगरपालिका, भक्तपुर, बाग्मती प्रदेश, 89130, नेपाल",Bhaktapur,Ghalate,,36000000.0,11.75,3063829.787234043,36000000.0,False,False,False,False
HB-9930FB,Kakrabari Land sale,"Basnetgau, Suryabinayak-09, Mahatgau, सूर्यविनायक नगरपालिका, भक्तपुर, बाग्मती प्रदेश, 89130, नेपाल",Bhaktapur,Basnetgau,Gravel Road,43200000.0,144.0,300000.0,43200000.0,False,False,True,True
HB-1D960F,Nagarkot Land Sale near buspark,"Nagarkot Buddha Peace Garden Hiking Trail, Changunarayan-06, चाँगुनारायण नगरपालिका, भक्तपुर, बाग्मती प्रदेश, 44812, नेपाल",Bhaktapur,Nagarkot Buddha Peace Garden Hiking Trail,Above 20 Ft,32000000.0,16.0,2000000.0,32000000.0,False,False,False,False
HB-1AA507,"Land on sell at Kapan Gumba , Kathmandu","kopan, Kapan, Kathmandu",Kathmandu,Kopan,Pitched Road,12000000.0,4.0,3000000.0,12000000.0,False,False,False,False
HB-8F39AE,"Planning Land on Sale at Godamchaur, GJBLOS 3413","Godamchaur (Godawari), Lalitpur",Lalitpur,Godawari,Gravel Road,1400000.0,4.0,1400000.0,5600000.0,False,False,False,False
HB-BC6480,"Planning Land on Sale at Chhampi, GJBLOS 3412","Champi (Karyabinayak), Lalitpur",Lalitpur,Champi,Gravel Road,1000000.0,4.0,1000000.0,4000000.0,False,False,False,False
HB-0A4E8D,"4 ana Land on sale in Budhanilkantha, Bhangal","bangal, Bhangal (Budhanilkantha), Kathmandu",Kathmandu,Bangal,Pitched Road,4500000.0,4.0,1125000.0,4500000.0,False,False,False,False
HB-065DCD,Land for sale in Budhanilkantha,"budanilkantha, Budhanilkantha, Kathmandu",Kathmandu,Budhanilkantha,Pitched Road,2900000.0,16.0,2900000.0,46400000.0,False,False,False,False
HB-8FA3EE,Land for sale in Budhanilkantha,"budanilkantha, Budhanilkantha, Kathmandu",Kathmandu,Budhanilkantha,Pitched Road,5200000.0,11.0,5200000.0,57200000.0,False,False,False,False
HB-0C9729,Land for sale Bhaktapur Suryebinayek Sirutar,"Balkot Dadhikot Sirutar Gamcha Patletar Gundu, Ananta Area, Bhaktapur",Bhaktapur,Balkot Dadhikot Sirutar Gamcha Patletar Gundu,Above 20 Ft,3600000.0,11.0,3600000.0,39600000.0,False,False,False,False
HB-616526,Land for Sale in Harisiddi 4aana 2paisa 2dam,"Harisiddhi, Lalitpur",Lalitpur,Harisiddhi,,2900000.0,4.5,2900000.0,13050000.0,False,False,False,False
HB-1F9A25,Land for Sale in Harisiddi 5aana,"Harisiddhi, Lalitpur",Lalitpur,Harisiddhi,,3300000.0,5.0,3300000.0,16500000.0,False,False,False,False
HB-87C03E,Land for Sale in Harisiddi 3.5aana,"Harisiddhi, Lalitpur",Lalitpur,Harisiddhi,,3200000.0,3.5,3200000.0,11200000.0,False,False,False,False
HB-5CE0F4,Land for Sale in Harisiddi 4aana 3 dam,"Harisiddhi, Lalitpur",Lalitpur,Harisiddhi,,3500000.0,4.0,3500000.0,14000000.0,False,False,False,False
HB-2B4C32,Land for Sale in Harisiddi 5aana,"Harisiddhi, Lalitpur",Lalitpur,Harisiddhi,,3500000.0,5.0,3500000.0,17500000.0,False,False,False,False
HB-2A8293,Land for Sale in Harisiddi 3aana,"Harisiddhi, Lalitpur",Lalitpur,Harisiddhi,,3300000.0,3.0,1100000.0,3300000.0,False,False,False,False
HB-BB10E3,Land for Sale in Harisiddi 3aana 3 paisa,"Harisiddhi, Lalitpur",Lalitpur,Harisiddhi,,2900000.0,3.75,2900000.0,10875000.0,False,False,False,False
HB-756F64,Land for Sale in Harisiddi 3aana 1 paisa,"Harisiddhi, Lalitpur",Lalitpur,Harisiddhi,,3200000.0,3.25,3200000.0,10400000.0,False,False,False,False
HB-821A5D,Land for Sale in Harisiddi 3aana 3 paisa,"Harisiddhi, Lalitpur",Lalitpur,Harisiddhi,,3600000.0,3.75,3600000.0,13500000.0,False,False,False,False
