ad_id,title,location_raw,district,neighborhood,road_type,raw_price,land_size_aana,price_per_aana,calculated_total_price,is_price_suspect,is_price_outlier,is_rate_outlier,is_large_plot
HB-298FAF,near iskcon temple narayanthan temple,"Budhanilkantha-02, बूढानीलकण्ठ, बूढानिलकण्ठ नगरपालिका, काठमाडौं, बागमती प्रदेश, 22644, नेपाल",Kathmandu,Budhanilkantha,13-20 Ft,3300000.0,7.0,3300000.0,23100000.0,False,False,False,False
HB-6CF319,"५ aana land for sale, Near Bishnumati Bajar","टोखा चण्डेश्वरि, Tokha-02, टोखा सरस्वती, टोखा नगरपालिका, काठमाडौं, बागमती प्रदेश, 44608, नेपाल",Kathmandu,टोखा चण्डेश्वरि,13-20 Ft,3300000.0,5.0,3300000.0,16500000.0,False,False,False,False
HB-4BB973,"5 aana commercial land for sale, Chyasundol Bajar","Budhanilkantha-06, बूढानीलकण्ठ, बूढानिलकण्ठ नगरपालिका, काठमाडौं, बागमती प्रदेश, 40607, नेपाल",Kathmandu,Budhanilkantha,9-12 Ft,4500000.0,5.0,4500000.0,22500000.0,False,False,False,False
HB-625F4A,"5 aana land for sale, Chyasundol Bishnumati","Chasundol, 1, Khatri Colony Road, Budhanilkantha-06, बूढानीलकण्ठ, बूढानिलकण्ठ नगरपालिका, काठमाडौं, बागमती प्रदेश, 44607, नेपाल",Kathmandu,Chasundol,13-20 Ft,3500000.0,5.0,3500000.0,17500000.0,False,False,False,False
HB-A5153D,"4 aana land for sale, Chyasundol Bishnumati","Chasundol, 1, Khatri Colony Road, Budhanilkantha-06, बूढानीलकण्ठ, बूढानिलकण्ठ नगरपालिका, काठमाडौं, बागमती प्रदेश, 44607, नेपाल",Kathmandu,Chasundol,13-20 Ft,3500000.0,4.0,3500000.0,14000000.0,False,False,False,False
HB-71F44E,"Land on Sale at Thankot Matikhel, GJBLOS 3473","Thankot (Chandragiri), Kathmandu",Kathmandu,Chandragiri,Gravel Road,2700000.0,4.0,2700000.0,10800000.0,False,False,False,False
HB-54CA4C,Sanepa Jhamsikhel Ma 7 Aana Jagga Bikre Ma,"Arun Thapa Murti Chowk, Sanepa, Lalitpur, Lalitpur Metropolitan City, Lalitpur",Lalitpur,Sanepa,Full Road,9500000.0,7.0,1357142.857142857,9500000.0,False,False,False,False
HB-DD30D1,Chamati Townplanning Ma 3 Aana Jagga Bikre Ma,"Dallu, Chamati, Kathmandu Metropolitan City, Kathmandu",Kathmandu,Dallu,Full Road,7500000.0,3.0,2500000.0,7500000.0,False,False,False,False
HB-976138,Budhanilkantha Ma 8 Aana Commercial Jagga Bikre Ma,"Budhanilkantha, Budhanilkantha Municipality, Kathmandu",Kathmandu,Budhanilkantha,Full Road,8500000.0,8.0,1062500.0,8500000.0,False,False,False,False
HB-D95B44,10 Ana Land For Sale At Basbari Kathmandu,"Bansbari, Kathmandu",Kathmandu,Bansbari,13-20 Ft,4000000.0,10.0,4000000.0,40000000.0,False,False,False,False
HB-61C95B,LAND FOR SALE SANA GAU LSLITPUR MAHALAXMI 6 NO.,"बोर्चा, Mahalaxmi-06, महालक्ष्मी, ललितपुर महानगरपालिका, ललितपुर, बागमती प्रदेश, 44708, नेपाल",Lalitpur,बोर्चा,13-20 Ft,2700000.0,4.0,2700000.0,10800000.0,False,False,False,False
HB-9ED648,Land for sale at Sanagaun,"ग्वार्को-लामाटार सडक, बोर्चा, Mahalaxmi-06, महालक्ष्मी, ललितपुर महानगरपालिका, ललितपुर, बागमती प्रदेश, 44795, नेपाल",Lalitpur,Gwarko,,5000000.0,8.0,5000000.0,40000000.0,False,False,False,False
HB-5A5803,"4.75 aana land for sale, Pasikot Budhanilkantha","NH38, खड्कागाउँ, Budhanilkantha-04, बूढानीलकण्ठ, बूढानिलकण्ठ नगरपालिका, काठमाडौं, बागमती प्रदेश, 22644, नेपाल",Kathmandu,खड्कागाउँ,13-20 Ft,4700000.0,4.75,4700000.0,22325000.0,False,False,False,False
HB-E0D2A3,"6 aana land for sale, Pasikot Budhanilkantha","खड्कागाउँ, Budhanilkantha-04, बूढानीलकण्ठ, बूढानिलकण्ठ नगरपालिका, काठमाडौं, बागमती प्रदेश, 22644, नेपाल",Kathmandu,खड्कागाउँ,9-12 Ft,4200000.0,6.0,4200000.0,25200000.0,False,False,False,False
HB-679933,3.25 Ana Land For Sale At Budhanilkantha Pasikot,"Budhanilkantha, Budhanilkantha Municipality, Kathmandu",Kathmandu,Budhanilkantha,Above 20 Ft,5000000.0,3.0,1666666.6666666667,5000000.0,False,False,False,False
HB-5F4DB9,3.5ana Land For Sale At Budhanilkantha Pasikot,"Budhanilkantha, Budhanilkantha Municipality, Kathmandu",Kathmandu,Budhanilkantha,13-20 Ft,4500000.0,3.0,1500000.0,4500000.0,False,False,False,False
HB-1AE538,7 Ana Land For Sale At Budhanilkantha Pasikot,"Budhanilkantha, Budhanilkantha Municipality, Kathmandu",Kathmandu,Budhanilkantha,13-20 Ft,43000000.0,7.0,6142857.142857143,43000000.0,False,False,False,False
HB-94B87E,4 Ana Land For Sale At Budhanilkantha Pasikot,"Budhanilkantha, Budhanilkantha Municipality, Kathmandu",Kathmandu,Budhanilkantha,13-20 Ft,4350000.0,4.0,1087500.0,4350000.0,False,False,False,False
HB-1E2122,10 Ana Land For Sale At Budhanilkantha Pasikot,"Budhanilkantha, Budhanilkantha Municipality, Kathmandu",Kathmandu,Budhanilkantha,Pitched Road,4500000.0,10.0,4500000.0,45000000.0,False,False,False,False
HB-02E815,8 Ana Land For Sale At Naxal Bhakbathan Kathmandu,"Police Headquarter, Gairidhara Road, Narayan Chaur, Kathmandu Metropolitan City, Kathmandu",Kathmandu,Police Headquarter,Above 20 Ft,17500000.0,8.0,2187500.0,17500000.0,False,False,False,False
HB-CB3333,8 Ana Land For Sale At Budhanilkantha Deuwa Chowk,"Budhanilkantha, Budhanilkantha Municipality, Kathmandu",Kathmandu,Budhanilkantha,Above 20 Ft,4500000.0,8.0,4500000.0,36000000.0,False,False,False,False
HB-7F5144,13 Ana Commercial Land For Sale At Baluwatar,"Rastra Bank, 341, Thirbam Sadak, Kirtan Chok, Baluwatar, Kathmandu Metropolitan City, Kathmandu",Kathmandu,Rastra Bank,Above 20 Ft,20000000.0,13.0,1538461.5384615385,20000000.0,False,False,False,False
HB-5DAEFB,jharuwarashi 3aana 2 paisa total 55lakh only,"Jharuwarasi, Godawari-13, Godawari, ललितपुर, बागमती प्रदेश, 44709, नेपाल",Lalitpur,Jharuwarasi,13-20 Ft,1625000.0,3.0,1625000.0,4875000.0,False,False,False,False
HB-3B48DB,land on sale khumaltra Ullens School lalitapur 5a,"Khumaltar Height Marg, NAST Research Centre, Khumaltar, Lalitpur, Lalitpur Metropolitan City, Lalitpur",Lalitpur,Khumaltar,13-20 Ft,5000000.0,5.0,1000000.0,5000000.0,False,False,False,False
HB-359963,FOR SALE 8 ROPANI LAND AT RAVIBHAWAN....,"Ravi Bhawan Soaltee Mode Kuleshwor Teku Chauni Tahachal Bafal, Kalimati Area, Kathmandu",Kathmandu,Ravi Bhawan Soaltee Mode Kuleshwor Teku Chauni Tahachal Bafal,,8000000.0,128.0,8000000.0,1024000000.0,False,True,False,True
HB-89259E,land on sale bhaisepati magargau lalitapur 10 aana,"Bhaisepati, Duniya Danda Chok, Lalitpur Metropolitan City, Lalitpur",Lalitpur,Bhaisepati,13-20 Ft,4200000.0,10.0,4200000.0,42000000.0,False,False,False,False
HB-6FC8DE,3 Aana1 paisa land on sale at sitapaila Kathmandu,"Nagarjun-05, नागार्जुन, नागार्जुन नगरपालिका, काठमाडौं, बागमती प्रदेश, 44620, नेपाल",Kathmandu,Nagarjun,9-12 Ft,4500000.0,3.0,1500000.0,4500000.0,False,False,False,False
HB-FB1F66,3 Aana 1 paisa land on sale at sitapaila Kathmandu,"Nagarjun-05, नागार्जुन, नागार्जुन नगरपालिका, काठमाडौं, बागमती प्रदेश, 44620, नेपाल",Kathmandu,Nagarjun,13-20 Ft,3100000.0,3.0,1033333.3333333334,3100000.0,False,False,False,False
HB-018E0B,4 Aana land on sale at Ramkot jayanti gau Kathmand,"Nagarjun-06, नागार्जुन, नागार्जुन नगरपालिका, काठमाडौं, बागमती प्रदेश, 44601, नेपाल",Kathmandu,Nagarjun,13-20 Ft,3100000.0,4.0,3100000.0,12400000.0,False,False,False,False
HB-98D34A,14.5 aana land on sale at budhanilkantha Kathmandu,"Budhanilkantha-01, बूढानीलकण्ठ, बूढानिलकण्ठ नगरपालिका, काठमाडौं, बागमती प्रदेश, 22644, नेपाल",Kathmandu,Budhanilkantha,13-20 Ft,3700000.0,14.0,3700000.0,51800000.0,False,False,False,False
HB-5C883B,6 aana 2 paisa land on sale at sitapaila Kathmandu,"Nagarjun-05, नागार्जुन, नागार्जुन नगरपालिका, काठमाडौं, बागमती प्रदेश, 44620, नेपाल",Kathmandu,Nagarjun,13-20 Ft,4600000.0,6.0,4600000.0,27600000.0,False,False,False,False
HB-F35EC7,FOR SALE 2.5 ROPANI LAND AT KULESHWOR,"Kuleshwor, Kathmandu",Kathmandu,Kuleshwor,,8000000.0,40.0,8000000.0,320000000.0,False,False,False,False
HB-F6AE98,land on sale jawalakhel lalitapur 16 aana,"Chidiyaghar Marga, Dhobighat, Lalitpur, Lalitpur Metropolitan City, Lalitpur",Lalitpur,Dhobighat,Above 20 Ft,12200000.0,16.0,12200000.0,195200000.0,False,False,False,False
HB-3BD5EF,Prime 1 Ropani Land for Sale in Kalanki!,"Kalanki, Kathmandu",Kathmandu,Kalanki,,4500000.0,16.0,4500000.0,72000000.0,False,False,False,False
HB-F6E0E4,Prime 7 Aana Land for Sale in Kalanki!,"Kalanki, Kathmandu",Kathmandu,Kalanki,Pitched Road,4500000.0,7.0,4500000.0,31500000.0,False,False,False,False
HB-1021B9,land on sale bhaisepati magargau lalitpur,"Ekantakuna - Tikabhairab Road, भैसेपाटी, Lalitpur-25, ललितपुर, ललितपुर महानगरपालिका, ललितपुर, बागमती प्रदेश, 13775, नेपाल",Lalitpur,Ekantakuna,13-20 Ft,3600000.0,4.0,3600000.0,14400000.0,False,False,False,False
HB-676CE7,"Land On Sale at Tikathali , Lalitpur","Tikathali (Mahalaxmi), Lalitpur",Lalitpur,Tikathali,Pitched Road,4300000.0,3.5,1228571.4285714286,4300000.0,False,False,False,False
HB-4E6E84,10 Aana land on sale at raniban Kathmandu,"बुद्ध चोक, एराहिटी, Nagarjun-01, नागार्जुन नगरपालिका, काठमाडौं, बागमती प्रदेश, 44601, नेपाल",Kathmandu,बुद्ध चोक,Above 20 Ft,5200000.0,10.0,5200000.0,52000000.0,False,False,False,False
HB-8DF9A4,जग्गा सस्तोमा तुरुन्तै बिक्रीमा।,"27DR032, Bhimeshwor Chowk, Shankharapur-09, Shankharapur, कागेश्वरी मनोहरा नगरपालिका, काठमाडौं, बागमती प्रदेश, 44603, नेपाल",Kathmandu,Shankharapur,Full Road,2200000.0,5.99853907962016,2200000.0,13196785.975164352,False,False,False,False
HB-3BA48C,"3.5 aana land on sale , kaushaltar bhaktapur","तेर्साटार, सानो थिमि, Madhyapur Thimi-02, Madhyapur Thimi, मध्यपुर थिमि नगरपालिका, भक्तपुर, बागमती प्रदेश, 44810, नेपाल",Bhaktapur,तेर्साटार,13-20 Ft,4850000.0,3.0,1616666.6666666667,4850000.0,False,False,False,False
HB-9F8378,Urgent Sell,"mathatirtha, Matatirtha (Chandragiri), Kathmandu",Kathmandu,Mathatirtha,Gravel Road,2700000.0,4.2,2700000.0,11340000.0,False,False,False,False
HB-4AE9A2,7 aana land for sale surya binayak bhaktapur,"Suryabinayak, Bhaktapur",Bhaktapur,Suryabinayak,,25200000.0,7.0,3600000.0,25200000.0,False,False,False,False
HB-7FAC08,3 AANA 1 DAM LAND FOR SALE AT BHAISEPATI,"bhaisipati, Bhaisepati / Sainbu, Lalitpur",Lalitpur,Bhaisepati,,15500000.0,3.10000292184076,4999995.287358055,15500000.0,False,False,False,False
HB-A35BC5,"Land on sale at Naxal,Kathmandu","Naxal, Kathmandu",Kathmandu,Naxal,Pitched Road,9000000.0,15.0,9000000.0,135000000.0,False,False,False,False
HB-7B1907,"3.75 AANA LAND/ HOUSE SALE AT SHOVAHITI,NAKHUDOL","nakkhudole, Nakhudole (Bhaisepati), Lalitpur",Lalitpur,Nakkhudole,,22500000.0,3.75,6000000.0,22500000.0,False,False,False,False
HB-C3BF94,4 Aana 2dam Land for Sale in Kalanki Near NBTC!,"Kalanki, Kathmandu",Kathmandu,Kalanki,,6000000.0,4.0,1500000.0,6000000.0,False,False,False,False
HB-708700,4 Aana 1 paisa Land for Sale in Kalanki Near NBTC!,"Kalanki, Kathmandu",Kathmandu,Kalanki,,6000000.0,4.25,1411764.705882353,6000000.0,False,False,False,False
HB-33E4E1,4 Aana 1 paisa Land for Sale in Kalanki Near NBTC!,"Kalanki, Kathmandu",Kathmandu,Kalanki,,6000000.0,4.25,1411764.705882353,6000000.0,False,False,False,False
HB-A9905D,"Land On Sale at Changathali , Lalitpur","Changathali (Mahalaxmi), Lalitpur",Lalitpur,Thali,Pitched Road,2800000.0,4.5,2800000.0,12600000.0,False,False,False,False
HB-FF93A7,"Land on sale at Chundevi,Kathmandu","Chundevi (Maharajgunj), Kathmandu",Kathmandu,Maharajgunj,Above 20 Ft,8500000.0,5.0,1700000.0,8500000.0,False,False,False,False
HB-0BCEE8,Residential & Commercial Land for sale in Bafal,"सितापाईला, Kathmandu-13, काठमाडौँ महानगरपालिका, काठमाडौं, बागमती प्रदेश, 44620, नेपाल",Kathmandu,सितापाईला,13-20 Ft,6500000.0,11.0,6500000.0,71500000.0,False,False,False,False
HB-2E9AB7,land on sale sunakothi lalitapur chibhal Gate 11aa,"Simako Chibahal Marg, Chibahal, Duniya Danda Chok, Lalitpur Metropolitan City, Lalitpur",Lalitpur,Chibahal,13-20 Ft,3400000.0,11.0,3400000.0,37400000.0,False,False,False,False
HB-64A808,3/4/5 Aana land on sale at swayambhu Kathmandu,"Nagarjun-03, नागार्जुन, नागार्जुन नगरपालिका, काठमाडौं, बागमती प्रदेश, 44620, नेपाल",Kathmandu,Nagarjun,13-20 Ft,6000000.0,4.0,1500000.0,6000000.0,False,False,False,False
HB-1684C4,"4 aana land for sale, Near Grande Tokha","Tokha-03, टोखा, टोखा नगरपालिका, काठमाडौं, बागमती प्रदेश, 44608, नेपाल",Kathmandu,Tokha,Above 20 Ft,35000000.0,4.0,8750000.0,35000000.0,False,False,False,False
HB-80DEA4,"5 aana land for sale, near Grande Tokha","टोखा चण्डेश्वरि, Tokha-02, टोखा सरस्वती, टोखा नगरपालिका, काठमाडौं, बागमती प्रदेश, 44608, नेपाल",Kathmandu,टोखा चण्डेश्वरि,13-20 Ft,4500000.0,5.0,4500000.0,22500000.0,False,False,False,False
HB-099125,Land For sell,"lolang, Goldhunga (Tarkeshwar), Kathmandu",Kathmandu,Lolang,,8775000.0,3.2,2742187.5,8775000.0,False,False,False,False
HB-18D0F2,land in saibu bhaiseyparty,"Talim Kendra Marg, Lalitpur-25, Duniya Danda Chok, ललितपुर महानगरपालिका, ललितपुर, बागमती प्रदेश, 13775, नेपाल",Lalitpur,ललितपुर महानगरपालिका,13-20 Ft,5600000.0,33.0,5600000.0,184800000.0,False,False,False,False
HB-E16B56,5 aana dhapakhel ma direct owner saga lenu,"Dhapakhel, Lalitpur",Lalitpur,Dhapakhel,Gravel Road,17500000.0,5.0,3500000.0,17500000.0,False,False,False,False
HB-68CB24,"Plot Land for Sale in Kirtipur, Panga","Bhatkepati Chobhar Dhalpa Gamcha Salyansthan Tyangala Phant Kirtipur, Kritipur Area, Kathmandu",Kathmandu,Kirtipur,Pitched Road,3500000.0,3.0,1166666.6666666667,3500000.0,False,False,False,False
HB-86D89E,5..5 ana Land For Sale At Budhanilkantha KTM,"Budhanilkantha, Budhanilkantha Municipality, Kathmandu",Kathmandu,Budhanilkantha,13-20 Ft,5000000.0,5.0,1000000.0,5000000.0,False,False,False,False
HB-71A657,17 Ana Land For Sale At Sukedhara Kathmandu,"Sukedhara, Kathmandu",Kathmandu,Sukedhara,Above 20 Ft,7000000.0,17.0,7000000.0,119000000.0,False,False,False,False
HB-1BF91B,6 Ana Land For Sale At Sukedhara KTM Face West,"Sukedhara, Kathmandu",Kathmandu,Sukedhara,9-12 Ft,6700000.0,6.0,1116666.6666666667,6700000.0,False,False,False,False
HB-F2BF3D,5.5 Ana Land For Sale At Sukedhara KTM Face South,"Sukedhara, Kathmandu",Kathmandu,Sukedhara,13-20 Ft,7300000.0,5.0,1460000.0,7300000.0,False,False,False,False
HB-0BCB95,5.5 Ana Land For Sale At Sukedhara Kathmandu,"Sukedhara, Kathmandu",Kathmandu,Sukedhara,13-20 Ft,7200000.0,5.0,1440000.0,7200000.0,False,False,False,False
HB-9A7D9C,4 ana land on sale bhaisepati Lalitpur,"Bugal Marg, Bungamati, Lalitpur-22, Satitar, ललितपुर महानगरपालिका, ललितपुर, बागमती प्रदेश, 44700, नेपाल",Lalitpur,Bungamati,13-20 Ft,4500000.0,4.0,1125000.0,4500000.0,False,False,False,False
HB-292534,4 Aana 2 paisa Land for Sale in Salyansthan!,"kritipur, Salyansthan (Kirtipur), Kathmandu",Kathmandu,Kirtipur,,3100000.0,4.5,3100000.0,13950000.0,False,False,False,False
HB-1F6DD5,Prime 7 Aana Land for Sale in Dhungeadda!,"dungeadda, Dhungeadda (Kalanki), Kathmandu",Kathmandu,Dungeadda,,5000000.0,7.0,5000000.0,35000000.0,False,False,False,False
HB-617350,4 Aana Land for Sale in Dhungeadda 400m Highway!,"dungeadda, Dhungeadda (Kalanki), Kathmandu",Kathmandu,Dungeadda,,6000000.0,4.0,1500000.0,6000000.0,False,False,False,False
HB-B34289,Prime 8 Aana Land for Sale in Dhungeadda!,"dungeadda, Dhungeadda (Kalanki), Kathmandu",Kathmandu,Dungeadda,,6000000.0,8.0,6000000.0,48000000.0,False,False,False,False
HB-2FAB7E,Prime 4 Aana Land for Sale in Dhungeadda!,"dungeadda, Dhungeadda (Kalanki), Kathmandu",Kathmandu,Dungeadda,,5500000.0,4.0,1375000.0,5500000.0,False,False,False,False
HB-7179A5,"3 aana land for sale, Hatigauda Budhanilkantha","गोल्फुटार मुख्य सडक, गोल्फुटार, Budhanilkantha-08, बूढानीलकण्ठ, बूढानिलकण्ठ नगरपालिका, काठमाडौं, बागमती प्रदेश, 22644, नेपाल",Kathmandu,गोल्फुटार मुख्य सडक,9-12 Ft,4000000.0,3.0,1333333.3333333333,4000000.0,False,False,False,False
HB-888E54,"Land on Sale at Thecho, code: GJBLOS 3516","techo, Thecho (Bajrabarahi), Lalitpur",Lalitpur,Techo,Gravel Road,3000000.0,6.0,3000000.0,18000000.0,False,False,False,False
HB-D97971,"Land on Sale at Ganeshchowk, GJBLOS 3514","budanilkantha, Hattigaunda (Budhanilkantha), Kathmandu",Kathmandu,Budhanilkantha,Gravel Road,3200000.0,9.5,3200000.0,30400000.0,False,False,False,False
HB-32EA9A,Land for sale at Bhaisepati .,"bhaisipati, Bhaisepati / Sainbu, Lalitpur",Lalitpur,Bhaisepati,Pitched Road,4700000.0,4.2,1119047.619047619,4700000.0,False,False,False,False
HB-B5E36A,"6.50 aana land for sale, Hepali height, Budhanilka","Budhanilkantha-07, टोखा, बूढानिलकण्ठ नगरपालिका, काठमाडौं, बागमती प्रदेश, 44607, नेपाल",Kathmandu,Budhanilkantha,13-20 Ft,5500000.0,6.5,5500000.0,35750000.0,False,False,False,False
HB-3DDAFF,land on sale bhaisepati chunikhel lalitapur -4-2-a,"Bhaisepati, Duniya Danda Chok, Lalitpur Metropolitan City, Lalitpur",Lalitpur,Bhaisepati,13-20 Ft,4400000.0,4.0,1100000.0,4400000.0,False,False,False,False
HB-5C905F,Phutung Ma 8 Aana Jagga Bikrima,"F80, Tarakeshwar, Tarakeshwar Municipality, Kathmandu",Kathmandu,Tarakeshwar,13-20 Ft,3200000.0,8.0,3200000.0,25600000.0,False,False,False,False
HB-3753B2,LAND FOR SALE MID BANESHWOR OPPOSITE TO VENUS,"Hearten Cafe, देवकोटा सडक, सिर्जना टोल, बानेश्वर, Kathmandu-10, काठमाडौँ महानगरपालिका, काठमाडौं, बागमती प्रदेश, 44703, नेपाल",Kathmandu,Hearten Cafe,Above 20 Ft,18000000.0,5.0,3600000.0,18000000.0,False,False,False,False
HB-0325DF,6Ana Land For Sale At Budhanilkantha Hepali Height,"Budhanilkantha, Budhanilkantha Municipality, Kathmandu",Kathmandu,Budhanilkantha,13-20 Ft,6500000.0,6.0,1083333.3333333333,6500000.0,False,False,False,False
HB-A881E0,10 Ana Land For Sale At Budhanilkantha Hattigauda,"Budhanilkantha, Budhanilkantha Municipality, Kathmandu",Kathmandu,Budhanilkantha,13-20 Ft,6000000.0,10.0,6000000.0,60000000.0,False,False,False,False
HB-0D1D04,12Ana Land For Sale At Budhanilkantha Ganesh Chowk,"Budhanilkantha, Budhanilkantha Municipality, Kathmandu",Kathmandu,Budhanilkantha,Above 20 Ft,6000000.0,12.0,6000000.0,72000000.0,False,False,False,False
HB-F3C4D6,4 Aana Land For Sale At Budhanilkantha Chapali,"Budhanilkantha, Budhanilkantha Municipality, Kathmandu",Kathmandu,Budhanilkantha,13-20 Ft,4300000.0,4.0,1075000.0,4300000.0,False,False,False,False
HB-C0575E,"Commercial Land For Sale at Teku, Main Highway","Teku, Kathmandu",Kathmandu,Teku,Above 20 Ft,165000000.0,11.0,15000000.0,165000000.0,False,False,False,False
HB-3A0FCA,Land on sale At Badbhanjyang,"Chandragiri-01, Chandragiri, चन्द्रागिरी नगरपालिका, काठमाडौं, बागमती प्रदेश, 44619, नेपाल",Kathmandu,Chandragiri,13-20 Ft,5000000.0,5.0,1000000.0,5000000.0,False,False,False,False
HB-BA92F3,land on sale sunakothi lalitapur 8 aana,"Chibahal, Duniya Danda Chok, Lalitpur Metropolitan City, Lalitpur",Lalitpur,Chibahal,13-20 Ft,3200000.0,8.0,3200000.0,25600000.0,False,False,False,False
HB-804FA3,5 Aana land for sale house free tyanglafat,"kritipur, Tyangala Phant (Kirtipur), Kathmandu",Kathmandu,Kirtipur,,25000000.0,5.0,5000000.0,25000000.0,False,False,False,False
HB-2B14DF,15 aana land for sale sanepa house for free,"Sanepa, Lalitpur",Lalitpur,Sanepa,Above 20 Ft,13000000.0,15.0,13000000.0,195000000.0,False,False,False,False
HB-6DFC73,Land With Old House On Sale At Tokh Near Bhutkhel,"Tokha Saraswati (Tokha), Kathmandu",Kathmandu,Tokha,Pitched Road,11000000.0,3.25,3384615.3846153845,11000000.0,False,False,False,False
HB-0AC989,कलंकी नजिकै जग्गा बिक्रीमा,"Chandragiri-13, नयाँ नैकाप, चन्द्रागिरी नगरपालिका, काठमाडौं, बागमती प्रदेश, 44618, नेपाल",Kathmandu,Chandragiri,Pitched Road,3500000.0,5.0,3500000.0,17500000.0,False,False,False,False
HB-C77DB3,4.5 Aana Land On Sale at Kamerotar,"Madhyapur Thimi-05, Madhyapur Thimi, मध्यपुर थिमि नगरपालिका, भक्तपुर, बागमती प्रदेश, 44811, नेपाल",Bhaktapur,Madhyapur Thimi,13-20 Ft,5100000.0,4.0,1275000.0,5100000.0,False,False,False,False
HB-96768B,18 Aana land for sale house free bhaisepati,"bhaisipati, Bhaisepati / Sainbu, Lalitpur",Lalitpur,Bhaisepati,,6500000.0,18.0,6500000.0,117000000.0,False,False,False,False
HB-F2A6BE,5 ANA LAND FOR SALE SUNAKOTHI LALITPUR,"Kalapa Tan Marg, Sunakothi, Lalitpur-26, Satitar, ललितपुर महानगरपालिका, ललितपुर, बागमती प्रदेश, 44700, नेपाल",Lalitpur,Sunakothi,,3500000.0,4.4996347699050405,3500000.0,15748721.694667641,False,False,False,False
HB-82AEA2,0-3-3-2 ANA LAND FOR SALE AT SUNAKOTHI LALITPUR,"Wakhat, Lalitpur-27, Satitar, ललितपुर महानगरपालिका, ललितपुर, बागमती प्रदेश, 44700, नेपाल",Lalitpur,Wakhat,,3000000.0,3.7983929875821767,3000000.0,11395178.96274653,False,False,False,False
HB-06721B,3 ana 3 paisa 3 dam Land for sale Sunakothi wakhat,"Shree Bal Kumari School, Phwangasi Marg, Wakhat, Lalitpur-27, Satitar, ललितपुर महानगरपालिका, ललितपुर, बागमती प्रदेश, 44700, नेपाल",Lalitpur,Wakhat,,2900000.0,3.7983929875821767,2900000.0,11015339.663988313,False,False,False,False
HB-E03A44,5 AANA LAND FOR SALE AT SUNAKOTHI,"Sunakothi, Lalitpur",Lalitpur,Sunakothi,,3500000.0,5.0,3500000.0,17500000.0,False,False,False,False
HB-C2C6ED,Land jagga bikrima near to tikathali clubward no7,"Tikathali (Mahalaxmi), Lalitpur",Lalitpur,Tikathali,,2500000.0,4.0,2500000.0,10000000.0,False,False,False,False
HB-F398DB,5 anna E facing 20ft road land for sale bhaisepati,"Alliant Insurance Brokrers, 303, थापाथली सडक, थापाथली, Kathmandu-11, काठमाडौँ महानगरपालिका, काठमाडौं, बागमती प्रदेश, 00779, नेपाल",Kathmandu,Alliant Insurance Brokrers,Gravel Road,4100000.0,5.0,4100000.0,20500000.0,False,False,False,False
HB-E75ED1,"Land for sale at champi , Lalitpur","Lalitpur-25, Duniya Danda Chok, ललितपुर महानगरपालिका, ललितपुर, बागमती प्रदेश, 13775, नेपाल",Lalitpur,ललितपुर महानगरपालिका,Gravel Road,1500000.0,3.5,1500000.0,5250000.0,False,False,False,False
HB-1904ED,"2 Ropani land for sale at Bhaisepati , Bungmati","Alliant Insurance Brokrers, 303, थापाथली सडक, थापाथली, Kathmandu-11, काठमाडौँ महानगरपालिका, काठमाडौं, बागमती प्रदेश, 00779, नेपाल",Kathmandu,Alliant Insurance Brokrers,Above 20 Ft,3050000.0,32.0,3050000.0,97600000.0,False,False,False,False
