ad_id,title,location_raw,district,neighborhood,road_type,raw_price,land_size_aana,price_per_aana,calculated_total_price,is_price_suspect,is_price_outlier,is_rate_outlier,is_large_plot
HB-449254,commercial land for sale in tokha,"Tokha-3, Kathmandu, Bagmati Pradesh",Kathmandu,Tokha,Above 20 Ft,7000000.0,3.0,2333333.3333333335,7000000.0,False,False,False,False
HB-DC6CF2,Land for sale near kmc hospital,"Kmc Hospital, Changunarayan-2, Bhaktapur",Bhaktapur,Changunarayan,,6500000.0,3.0,2166666.6666666665,6500000.0,False,False,False,False
HB-72A275,10 Aana Land On Sale At Shivapuri Colony.,"बूढानीलकण्ठ, बूढानीलकण्ठ नगरपालिका, काठमाडौं जिल्ला",Kathmandu,बूढानीलकण्ठ,13-20 Ft,5300000.0,10.0,5300000.0,53000000.0,False,False,False,False
HB-6CE9DF,Land on sale,"Godawari Bridge, Gwarko-Lamatar, Mahalaxmi-8, Lalitpur",Lalitpur,Godawari,,3000000.0,3.5,3000000.0,10500000.0,False,False,False,False
HB-5E933A,15 Aana Land On Sale Near Lemon Tree Hotel.,"बूढानीलकण्ठ, बूढानीलकण्ठ नगरपालिका, काठमाडौं जिल्ला",Kathmandu,बूढानीलकण्ठ,13-20 Ft,4500000.0,15.0,4500000.0,67500000.0,False,False,False,False
HB-B4FBC4,Kapan Tenzin Chok Ma 6anna Jagga Sell Ma,"F84, Tenzing Chok, Budhanilkantha, Budhanilkantha Municipality, Kathmandu",Kathmandu,Budhanilkantha,13-20 Ft,6000000.0,6.0,1000000.0,6000000.0,False,False,False,False
HB-3A8E36,Land For Sale At Chandragiri,"Matatirtha, Chandragiri-6, Kathmandu, Bagmati Pradesh",Kathmandu,Matatirtha,Gravel Road,2500000.0,6.0,2500000.0,15000000.0,False,False,False,False
HB-500628,land for sale bhanimandal lalitpur 10 aana,"DAV Sushil Kedia Vishwa Bharati School, दमकल सुन्दरीघाट मार्ग, Dhobighat, Lalitpur, Lalitpur Metropolitan City, Lalitpur",Lalitpur,दमकल सुन्दरीघाट मार्ग,Above 20 Ft,1050000.0,10.0,1050000.0,10500000.0,False,False,False,False
HB-6E7D12,6 aana perfect land on sale near Metro apartment,"Swastik Marg, Kathmandu-14, Kathmandu, Bagmati Pradesh",Kathmandu,Swastik Marg,,9000000.0,6.0,1500000.0,9000000.0,False,False,False,False
HB-D76F6F,land for sale jawalakhel lalitpur 6 aana,"Damodar Marga, Ekantakuna, Lalitpur, Lalitpur Metropolitan City, Lalitpur",Lalitpur,Ekantakuna,Above 20 Ft,11000000.0,6.0,1833333.3333333333,11000000.0,False,False,False,False
HB-3865E4,Land for Sale at Dhapakhel,"Dhapakhel Hp, Lalitpur-15, Lalitpur",Lalitpur,Dhapakhel,Above 20 Ft,3500000.0,10.0,3500000.0,35000000.0,False,False,False,False
HB-589245,Land for Sale Kirtipur Near Jal Binayak Colony!,"Jalbinayak Colony, Kirtipur-6, Kathmandu",Kathmandu,Jalbinayak Colony,,3200000.0,3.0,1066666.6666666667,3200000.0,False,False,False,False
HB-1DCC5E,"Land On Sale At Pasikot, Budhanilkantha","Pasikot, Budhanilakantha-4, Kathmandu",Kathmandu,Pasikot,Pitched Road,4400000.0,4.5,4400000.0,19800000.0,False,False,False,False
HB-8CE6AE,land for sale kupandol lalitpur 17 aana,"Upendra Marg, Lalitpur, Lalitpur Metropolitan City, Lalitpur",Lalitpur,Upendra Marg,9-12 Ft,6500000.0,17.0,6500000.0,110500000.0,False,False,False,False
HB-CEFBE8,Land On Sale At Baluwatar,"Baluwatar-4, Kathmandu-4, Kathmandu",Kathmandu,Baluwatar,Pitched Road,6500000.0,4.5,1444444.4444444445,6500000.0,False,False,False,False
HB-A58F36,Residential Land for Sale Old Naikap Near Kalanki,"Kalanki-14 Khadkagau, Chandragiri-13, Kathmandu",Kathmandu,Kalanki,,2700000.0,3.5,2700000.0,9450000.0,False,False,False,False
HB-FDCD05,"Land On Sale At Pasikot, Budhanilkantha","Pasikot Futsal, Budhanilakantha-4, Kathmandu",Kathmandu,Pasikot Futsal,Gravel Road,4500000.0,4.59,4500000.0,20655000.0,False,False,False,False
HB-B2562A,Land for sale in bramakhal Kathmandu,"Bramhakhel Dhunge Dhara, Kageshwori Manahora-4, Kathmandu",Kathmandu,Bramhakhel Dhunge Dhara,Above 20 Ft,2500000.0,4.75,2500000.0,11875000.0,False,False,False,False
HB-93CC27,"RESIDENTIAL LAND ON SALE AT DHAPA VALLEY, Dhapakhe","Dhapa Valley, Lalitpur-24, Lalitpur",Lalitpur,Dhapa Valley,,3250000.0,5.0,3250000.0,16250000.0,False,False,False,False
HB-A76854,land sale,"Chandragiri-2, Kathmandu, Bagmati Pradesh",Kathmandu,Chandragiri,13-20 Ft,2000000.0,3.0,2000000.0,6000000.0,False,False,False,False
HB-A9E7DD,Land On Sale At Budhanilkantha,"Budhanilkantha, Budhanilakantha-2, Kathmandu",Kathmandu,Budhanilkantha,Gravel Road,2500000.0,6.5,2500000.0,16250000.0,False,False,False,False
HB-7A0D68,4 Anna Land For Sale Very Reasonable Price,"Nagarjun, Nagarjun Municipality, Kathmandu",Kathmandu,Nagarjun,13-20 Ft,3800000.0,4.0,3800000.0,15200000.0,False,False,False,False
HB-384C1B,बालुवाटारमा ४.५ आना जग्गा तुरुन्त बिक्रीमा,"Baluwatar, Kathmandu-4, Kathmandu, Bagmati Pradesh",Kathmandu,Baluwatar,9-12 Ft,6300000.0,4.0,1575000.0,6300000.0,False,False,False,False
HB-629CF4,JHAMSIKHEL – 10 AANA SEMI-COMMERCIAL LAND,"Jhamsikhel, Lalitpur-3, Lalitpur",Lalitpur,Jhamsikhel,,100000000.0,10.0,10000000.0,100000000.0,False,False,False,False
HB-177CBD,Land & House On Sell,"Khadka Bhadrakali, Budhanilkantha, Budhanilkantha Municipality, Kathmandu",Kathmandu,Khadka Bhadrakali,Full Road,100.0,10.226442658875092,10000000.0,102264426.58875091,False,False,False,False
HB-486543,"Commercial Land On Sale At Dhapakhel, Lalitpur.","Dhapakhel Hp, Lalitpur-15, Lalitpur",Lalitpur,Dhapakhel,Above 20 Ft,5500000.0,4.0,1375000.0,5500000.0,False,False,False,False
HB-E9A7F8,5.5 Aana @ Sankhu- Near Malpot - @18 lacs/ Aana,"Sankhu Malpot Office, salinadi road, Shankharapur-6, Kathmandu",Kathmandu,Shankharapur,,1800000.0,5.5,1800000.0,9900000.0,False,False,False,False
HB-AD8D5A,7.1 Aana Land On Sale At Dhumbarahi Hams Hospital,"Dhumbarahi, Kathmandu",Kathmandu,Dhumbarahi,13-20 Ft,48500000.0,7.1,6830985.915492958,48500000.0,False,False,False,False
HB-FE0EB3,4.1 Aana Land On Sale At Sukedhara Area,"Sukedhara Area, Kathmandu",Kathmandu,Sukedhara,13-20 Ft,30000000.0,4.1,7317073.170731708,30000000.0,False,False,False,False
HB-867F84,Land on sale at machhegaun Naaikap 4Aana,"Chandragiri-9, Kathmandu, Bagmati Pradesh",Kathmandu,Chandragiri,,2500000.0,5.843681519357195,2500000.0,14609203.798392987,False,False,False,False
HB-A10874,land sale,"620 Ward office - Ghamdhoka Marga Chagunarayan Temmple Area, Chagunarayan Temmple Area, Changu Narayan, Sangdaha- Changu Road, Changunarayan-4, Bhaktapur, Bagmati Pradesh",Bhaktapur,Chagunarayan Temmple,,26.0,5.0,2600000.0,13000000.0,False,False,False,False
HB-D9E191,land for sale in hattiban Lalitpur,"Hattiban, Mahalaxmi-4, Lalitpur",Lalitpur,Hattiban,Pitched Road,4000000.0,55.0,4000000.0,220000000.0,False,False,False,True
HB-01F416,"Commercial Land for Sale – Dhungedhara, Banasthali","Sachin Hardware Centre, Kathmandu-15, Kathmandu",Kathmandu,Sachin Hardware Centre,,120000000.0,9.934258582907232,12079411.764705881,120000000.0,False,False,False,False
HB-BBEA40,Land urgent sale at Saraswati khel,"Changunarayan-1, Bhaktapur, Bagmati Pradesh",Bhaktapur,Changunarayan,Above 20 Ft,2000000.0,6.0,2000000.0,12000000.0,False,False,False,False
HB-D62F20,land for sale,"Autism Care Nepal Society, Lalitpur-29, Lalitpur",Lalitpur,Autism Care  Society,Above 20 Ft,9500000.0,3.75,2533333.3333333335,9500000.0,False,False,False,False
HB-76D1EF,KUPONDOLE – 8 AANA LAND FOR SALE,"Kupondole Rd, Kupondol Marg, Lalitpur-10, Lalitpur",Lalitpur,Kupondole Rd,Pitched Road,88000000.0,8.0,11000000.0,88000000.0,False,False,False,False
HB-8A4B8D,"8 Aana land for sale in Taukhel,Machchhegaun .","Chandagiri Furniture And Sofa Hub, Chandragiri-11, Kathmandu",Kathmandu,Chandragiri,Gravel Road,38400000.0,8.0,4800000.0,38400000.0,False,False,False,False
HB-D00826,sale,"Ban Danda Marg, Lalitpur-25, Lalitpur, Bagmati Pradesh",Lalitpur,Ban Danda Marg,Above 20 Ft,5800000.0,5.0,1160000.0,5800000.0,False,False,False,False
HB-9EF6B4,Sasto jagga,"Lalitpur Nepal, Mahalaxmi-4, Lalitpur",Lalitpur,Mahalaxmi,,650000.0,10.0,650000.0,6500000.0,False,False,False,False
HB-C08599,2.5 aana land sale on nepaltar Kathmandu,"Nepaltar, Ratna Park - Phutang, Tarakeshwor-11, Kathmandu",Kathmandu,Ratna Park,Pitched Road,7000000.0,2.5,2800000.0,7000000.0,False,False,False,False
HB-20BF88,Land for sale,"Sano Bharyang, Nagarjun-2, Kathmandu, Bagmati Pradesh",Kathmandu,Sano Bharyang,13-20 Ft,25000000.0,5.0,5000000.0,25000000.0,False,False,False,False
HB-E8191A,18 aana Land for Sale in Danchhi,"Kageshwori Manahora-3, Kathmandu, Bagmati Pradesh",Kathmandu,Kageshwori Manahora,,36000000.0,18.0,2000000.0,36000000.0,False,False,False,False
HB-D30C10,Land on Sale at Sundarbasti,"Sundar Basti Marga, Budhanilakantha-1, Kathmandu",Kathmandu,Budhanilkantha,Pitched Road,4700000.0,5.0,4700000.0,23500000.0,False,False,False,False
HB-C1CB2A,Land on sale at Godawari Taukhel,"Taukhel, Godawari-3, Lalitpur",Lalitpur,Taukhel,Pitched Road,6200000.0,6.6875,6200000.0,41462500.0,False,False,False,False
HB-F7F213,land on sale kathmandu ko lagimpa haitma ho,"Maharajganj, लाजिम्पाट सडक, Kathmandu-3, Kathmandu, Bagmati Pradesh",Kathmandu,Maharajganj,13-20 Ft,8000000.0,4.0,2000000.0,8000000.0,False,False,False,False
HB-3163BA,land for sale dholaiti lalitpur 3 aana,"Euro Kids, कान्ति लोकपथ, Lalitpur, Lalitpur Metropolitan City, Lalitpur",Lalitpur,Euro Kids,13-20 Ft,6000000.0,3.0,2000000.0,6000000.0,False,False,False,False
HB-55D857,Medicity Hospital Najikai 1 Ropani 3 Paisa jagga,"Nakkhu Jal Binayak Marg, Lalitpur-18, Lalitpur, Bagmati Pradesh",Lalitpur,Nakkhu Jal Binayak Marg,Pitched Road,67.0,16.75,6700000.0,112225000.0,False,False,False,False
HB-FBB6F1,near by 1000 ropani,"Suryabinayak-9, Bhaktapur, Bagmati Pradesh",Bhaktapur,Suryabinayak,Gravel Road,450.0,4.0,45000000.0,180000000.0,False,False,False,False
HB-DE8393,"— 4.5 Aana Land For Sale — 📍Pasikot,","kapurchowk road, Budhanilakantha-4, Kathmandu, Bagmati Pradesh",Kathmandu,Budhanilkantha,Above 20 Ft,6500000.0,4.0,1625000.0,6500000.0,False,False,False,False
HB-2A5D7E,land for sale in chapali,"Budhanilakantha-8, Kathmandu, Bagmati Pradesh",Kathmandu,Budhanilkantha,13-20 Ft,5000000.0,10.0,5000000.0,50000000.0,False,False,False,False
HB-4840BB,Land sale near Chobar Dry Port,"Chobhar Dry Port, Kirtipur-6, Kathmandu",Kathmandu,Chobhar Dry Port,Above 20 Ft,3400000.0,4.0,3400000.0,13600000.0,False,False,False,False
HB-3DD494,12 Aana Land For sale In Koteshwor,"Koteshwor, Kathmandu-32, Kathmandu",Kathmandu,Koteshwor,,8000000.0,12.0,8000000.0,96000000.0,False,False,False,False
HB-E33B85,Land on sale,"Godawari-5, Lalitpur, Bagmati Pradesh",Lalitpur,Godawari,Gravel Road,650000.0,22.0,650000.0,14300000.0,False,False,False,False
HB-F4C8CC,Commercial or Residential Land On Sale At Shantina,"Shantinagar, Radha Mohan Marga, Kathmandu-31, Kathmandu",Kathmandu,Shantinagar,Above 20 Ft,10000000.0,8.0,1250000.0,10000000.0,False,False,False,False
HB-33380D,land for sale in budhanilkantha,"Rudreswar Chowk, Budhanilakantha-5, Kathmandu, Bagmati Pradesh",Kathmandu,Budhanilkantha,13-20 Ft,5500000.0,3.0,1833333.3333333333,5500000.0,False,False,False,False
HB-BD4CD8,4 ana land for sale at Naikap near highway,"Chandragiri-14, Kathmandu, Bagmati Pradesh",Kathmandu,Chandragiri,,3500000.0,4.0,3500000.0,14000000.0,False,False,False,False
HB-0ABD18,Land On Sale At Budhanilkantha,"Budhanilkantha School, Budhanilakantha-3, Kathmandu",Kathmandu,Budhanilkantha,Gravel Road,3500000.0,16.0,3500000.0,56000000.0,False,False,False,False
HB-CB3C21,Land on sale at viral planning surayabinayak 8 bkt,"Suryabinayak-8, Bhaktapur, Bagmati Pradesh",Bhaktapur,Suryabinayak,Above 20 Ft,9062500.0,3.0,3020833.3333333335,9062500.0,False,False,False,False
HB-867964,5 ropani Land for Sale In Sankhu,"salinadi road, Shankharapur, Kathmandu",Kathmandu,Shankharapur,Above 20 Ft,1500000.0,86.0,1500000.0,129000000.0,False,False,False,True
HB-19342B,Land On Sale At Budhanilkantha,"Budhanilkantha, Budhanilakantha-2, Kathmandu",Kathmandu,Budhanilkantha,Pitched Road,4500000.0,4.0,1125000.0,4500000.0,False,False,False,False
HB-6451D5,land for sale bhaisepati magargau lalitpur 4 aana,"Sainbu, Lalitpur, Lalitpur Metropolitan City, Lalitpur",Lalitpur,Sainbu,Above 20 Ft,5300000.0,4.0,1325000.0,5300000.0,False,False,False,False
HB-4D0A4B,भक्तपुर झौखेल ७ (16 aana land Sell ),"Technerd Gadgets, Changunarayan-3, Bhaktapur",Bhaktapur,Technerd Gadgets,Above 20 Ft,2500000.0,16.0,2500000.0,40000000.0,False,False,False,False
HB-B313E9,LAND FOR SALE BHAKTAPUR SALLAGHARI KATUNJE SUWARNA,"Chundevi, Suryabinayak-5, Bhaktapur, Bagmati Pradesh",Bhaktapur,Chundevi,13-20 Ft,3500000.0,6.0,3500000.0,21000000.0,False,False,False,False
HB-625CD9,BHAISEPATI NAKKHUDOLE – 4 AANA LAND FOR SALE,"Bhaisepati, Kirtipur-6, Kathmandu",Kathmandu,Bhaisepati,,32500000.0,4.0,8125000.0,32500000.0,False,False,False,False
HB-F56763,BAGDOLE – 7 ANA LAND FOR SALE,"Bagdole-4, Home No.195, Lalitpur-4, Lalitpur",Lalitpur,Bagdole,Pitched Road,36400000.0,7.0,5200000.0,36400000.0,False,False,False,False
HB-257D52,2.5 Anna Land on Sale Naya Naikap,"Naikap, Chandragiri-14, Kathmandu",Kathmandu,Naikap,Gravel Road,3700000.0,2.5,1480000.0,3700000.0,False,False,False,False
HB-41CEDB,1 ropani land on demand from pepsicola !,"Pepsicola, Bafal Marg, Kathmandu-13, Kathmandu",Kathmandu,Pepsicola,Pitched Road,6000000.0,16.0,6000000.0,96000000.0,False,False,False,False
HB-180B6E,"34 Aana Land For Sale At Sankhu, Salinadi","salinadi road, Shankharapur, Kathmandu",Kathmandu,Shankharapur,13-20 Ft,1300000.0,34.0,1300000.0,44200000.0,False,False,False,False
HB-938167,Land And House For Sale Baneshwor,"Budhanilkantha, Budhanilkantha Municipality, Kathmandu",Kathmandu,Budhanilkantha,Above 20 Ft,105000000.0,10.0,10500000.0,105000000.0,False,False,False,False
HB-6BFA52,Sasto ma 3 ana 40lac only,"Police Sector, Matatirtha, Chandragiri-8, Kathmandu",Kathmandu,Police Sector,,4000000.0,3.0,1333333.3333333333,4000000.0,False,False,False,False
HB-AE4A83,"Plotted Land Sale with Purja, VIP Dhapakhel Height","Airawa Tol, Hattiban, Lalitpur, Lalitpur Metropolitan City, Lalitpur",Lalitpur,Airawa Tol,13-20 Ft,4000000.0,4.0,1000000.0,4000000.0,False,False,False,False
HB-089897,land for sale,"706 Tikhedebal Marg, Jambu Tole, Shovahiti, Jambu Marg, Lalitpur-14, Lalitpur, Bagmati Pradesh",Lalitpur,Jambu Tole,,5500000.0,6.0,5500000.0,33000000.0,False,False,False,False
HB-2A54EC,Land Sale Near Shital Height,"Orpach, Mahalaxmi, Mahalaxmi Municipality, Lalitpur",Lalitpur,Orpach,13-20 Ft,3990000.0,5.0,3990000.0,19950000.0,False,False,False,False
HB-FDD2D3,"Land for Sale in Kirtipur, Chugaun","Rarahill Futsal., Kirtipur-9, Kathmandu",Kathmandu,Rarahill Futsal.,Gravel Road,3600000.0,3.0,1200000.0,3600000.0,False,False,False,False
HB-DF78AA,Land On Sale At Chandol,"Switch On Chandol, Kathmandu-4, Kathmandu",Kathmandu,Switch On Chandol,Pitched Road,7000000.0,7.0,1000000.0,7000000.0,False,False,False,False
HB-EE8829,GOKARNA main road ma 8 anna jagga tu bikrima,"Bhandari Street, Gokarneshwor-4, Kathmandu, Bagmati Pradesh",Kathmandu,Bhandari Street,Above 20 Ft,4500000.0,8.0,4500000.0,36000000.0,False,False,False,False
HB-2A5271,Land On Sale At Tokha,"Tokha Polish Station, Tokha Road, Tokha-3, Kathmandu",Kathmandu,Tokha,Pitched Road,4500000.0,8.0,4500000.0,36000000.0,False,False,False,False
HB-FCC693,19.3 Aana Land For Sale In Budanilkantha,"Budanilkantha, Budhanilakantha-1, Kathmandu",Kathmandu,Budhanilkantha,,7000000.0,19.3,7000000.0,135100000.0,False,False,False,False
HB-2E86CF,24 Aana Land For Sale In Kirtipur,"Kirtipur, Ajaya Marga, Kirtipur-6, Kathmandu",Kathmandu,Kirtipur,,2300000.0,24.0,2300000.0,55200000.0,False,False,False,False
HB-ED0C51,land for sale sanepa lalitpur 10 aana,"Lalitpur, Lalitpur Metropolitan City, Lalitpur",Lalitpur,Unknown,Above 20 Ft,8500000.0,10.0,8500000.0,85000000.0,False,False,False,False
HB-922D21,Land for sale prime location of Baluwatar,"Nepal House Resturent - नेपाल हाउस रेस्टुरेन्ट, बार र बेकरी, Shree Hari Marg, Kathmandu-4, Kathmandu",Kathmandu,नेपाल हाउस रेस्टुरेन्ट,Above 20 Ft,19000000.0,20.0,950000.0,19000000.0,False,False,False,False
HB-7DC97F,DALLU|CHAGEL,"Ganesh Temple, Dallu, Amar Chitrakar Marg, Kathmandu-15, Kathmandu",Kathmandu,Ganesh Temple,Pitched Road,6000000.0,12.5,6000000.0,75000000.0,False,False,False,False
HB-D6F0D8,Residential Land for Sale in Kirtipur Nagaun Area!,"Nagaun Dobato नगाँ दोबाटो, Kirtipur Ring Road, Kirtipur-9, Kathmandu",Kathmandu,Nagaun Dobato नगाँ दोबाटो,,5500000.0,5.25,1047619.0476190476,5500000.0,False,False,False,False
HB-120A47,Nayapati's Land on Sale,"B.p. Museum Sundarijal, Gokarneshwor-1, Kathmandu",Kathmandu,B.P. Museum Sundarijal,Pitched Road,2100000.0,10.125,2100000.0,21262500.0,False,False,False,False
HB-A92D21,JHAMSIKHEL – 16 AANA LAND FOR SALE,"Jhamsikhel, Lalitpur-3, Lalitpur",Lalitpur,Jhamsikhel,Pitched Road,195200000.0,16.0,12200000.0,195200000.0,False,False,False,False
HB-CE1E62,JHAMSIKHEL – 12 AANA COLONY LAND FOR SALE,"Jhamsikhel, Lalitpur-3, Lalitpur",Lalitpur,Jhamsikhel,,150000000.0,12.0,12500000.0,150000000.0,False,False,False,False
HB-C71CCF,Land On Sale At Dhumbarahi,"Dhumbarahi Pipal Bot, Dhumbharai Marg, Kathmandu-4, Kathmandu",Kathmandu,Dhumbarahi,Pitched Road,6500000.0,4.5,1444444.4444444445,6500000.0,False,False,False,False
HB-2AE0AB,Lazimpat Land @40 lakh/aana near Uttardhoka urgent,"Kholagaal, Kathmandu-2, Kathmandu",Kathmandu,Kholagaal,,4000000.0,5.875,4000000.0,23500000.0,False,False,False,False
HB-48EEF0,Land in sale Chapali Bhudanilkantha,"Chapali Chok, Budhanilakantha-3, Kathmandu, Bagmati Pradesh",Kathmandu,Budhanilkantha,Pitched Road,6500000.0,14.0,6500000.0,91000000.0,False,False,False,False
HB-7493E1,4 aana 1paisa afnai jagga ho direct call garnus….,"Tersatar Planning, Madhyapur Thimi-2, Bhaktapur",Bhaktapur,Tersatar Planning,Pitched Road,5500000.0,4.25,1294117.6470588236,5500000.0,False,False,False,False
HB-FDFCF9,land for sale in budhanilkantha,"Budhanilakantha-1, Kathmandu, Bagmati Pradesh",Kathmandu,Budhanilkantha,13-20 Ft,5500000.0,6.0,5500000.0,33000000.0,False,False,False,False
HB-531EB9,1.5 ropani land for rent,"Mandikhatar, Budhanilakantha-9, Kathmandu, Bagmati Pradesh",Kathmandu,Mandikhatar,Above 20 Ft,140000.0,24.0,140000.0,3360000.0,False,False,True,False
HB-7FEE88,Kusume rumal justo mileko jagga,"Borcha, Mahalaxmi-8, Lalitpur, Bagmati Pradesh",Lalitpur,Borcha,Gravel Road,35.0,6.25,3500000.0,21875000.0,False,False,False,False
HB-FB5C1D,3 Anna land on sale harisidhi lalitpur,"Safal Tol, Dhyakwa Marg, Lalitpur-29, Lalitpur, Bagmati Pradesh",Lalitpur,Safal Tol,,4500000.0,3.0,1500000.0,4500000.0,False,False,False,False
HB-F75871,Land for Sale in Chobar/Kritipur,"Itagol, Kirtipur-6, Kathmandu, Bagmati Pradesh",Kathmandu,Itagol,Above 20 Ft,2500000.0,21.0,2500000.0,52500000.0,False,False,False,False
HB-E7EF4D,4ft bato bhako 3.1 aana jagga sasto ma sale ma ch,"Tarkeshwor Nagarpalika, Tarakeshwor-11, Kathmandu",Kathmandu,Tarakeshwor,Pitched Road,7500000.0,3.1,2419354.8387096776,7500000.0,False,False,False,False
HB-ECCC44,"Only 1 cr, land on sale ! Urgent ! at Jhor, Tokha","Tokha, Uttar Dhoka Road, Kathmandu-1, Kathmandu",Kathmandu,Tokha,Gravel Road,10000000.0,5.2,1923076.923076923,10000000.0,False,False,False,False
HB-C82880,land for sale karevinayk khokhana lalitpur 6.5 ana,"EMMANUEL MOBILE CENTER, Khokana Marg Paschim, Khokana, Lalitpur, Lalitpur Metropolitan City, Lalitpur",Lalitpur,Emmanuel Mobile Center,Above 20 Ft,3600000.0,6.0,3600000.0,21600000.0,False,False,False,False
HB-53B296,8 aana land on sale at Bansbari,"Bansbari Kathamandu, Kathmandu-3, Kathmandu",Kathmandu,Bansbari,,5600000.0,8.0,5600000.0,44800000.0,False,False,False,False
HB-7AA945,Lalitpur Dukuchhap,"Tikhidewal, Lalitpur-14, Lalitpur, Bagmati Pradesh",Lalitpur,Tikhidewal,13-20 Ft,1080000.0,5.0,1080000.0,5400000.0,False,False,False,False
HB-41AFF8,40.5 Aana Land For Sale In Kirtipur,"Kirtipur Cafeteria, Kirtipur-10, Kathmandu",Kathmandu,Kirtipur,,1500000.0,40.5,1500000.0,60750000.0,False,False,False,False
HB-04B691,SUNAKOTHI – 1 ROPANI LAND FOR SALE,"Sunakothi, Lalitpur-25, Lalitpur",Lalitpur,Sunakothi,,4500000.0,16.0,4500000.0,72000000.0,False,False,False,False
HB-91AD1D,land for sale bhaisepati karevinayk lalitpur 17 an,"Lalitpur, Lalitpur Metropolitan City, Lalitpur",Lalitpur,Unknown,Above 20 Ft,220000.0,17.0,220000.0,3740000.0,False,False,True,False
HB-C4DF16,Land on sale at Sainbu Bhaisepati,"Bhaisepati, Kirtipur-6, Kathmandu",Kathmandu,Bhaisepati,Pitched Road,5300000.0,5.625,5300000.0,29812500.0,False,False,False,False
HB-5BFAC3,25 Aana Land For Sale In Thankot,"Thankot, Chandragiri-4, Kathmandu",Kathmandu,Thankot,,3500000.0,25.0,3500000.0,87500000.0,False,False,False,False
HB-A21A4E,"Land for sale Bhaisepati, Lalitpur","Bhaisepati, Lalitpur, Lalitpur-18, Lalitpur",Lalitpur,Bhaisepati,Pitched Road,5800000.0,5.5,1054545.4545454546,5800000.0,False,False,False,False
HB-FC5E42,Land on sale,"Maharajgunj Kathmandu Nepal, Kathmandu-3, Kathmandu",Kathmandu,Maharajgunj,Above 20 Ft,8800000.0,5.0,1760000.0,8800000.0,False,False,False,False
HB-5B40AF,Residential Land for Sale in Kirtipur – Thapa Gau!,"Kirtipur, Kathmandu-16, Kathmandu",Kathmandu,Kirtipur,,2400000.0,6.75,2400000.0,16200000.0,False,False,False,False
HB-59EA23,land on sale chabal,"चाहबिल तरकारी बजार, Kathmandu-7, Kathmandu",Kathmandu,चाहबिल तरकारी बजार,Pitched Road,6600000.0,7.0,6600000.0,46200000.0,False,False,False,False
HB-BCD796,5.56 Aana Setipakha/Harisiddhi residential land,"Setipakha, Mahalaxmi-4, Lalitpur",Lalitpur,Setipakha,Above 20 Ft,3800000.0,5.56,3800000.0000000005,21128000.0,False,False,False,False
HB-31E553,"Commercial Land On Sale at Bhotebhala,Kathmandu.","Bhote Bahal, Kathmandu-11, Kathmandu",Kathmandu,Bhote Bahal,Above 20 Ft,9200000.0,14.0,9200000.0,128800000.0,False,False,False,False
HB-515EA2,land for sale in basundhara,"Kathmandu-3, Kathmandu, Bagmati Pradesh",Kathmandu,Unknown,13-20 Ft,5500000.0,3.0,1833333.3333333333,5500000.0,False,False,False,False
HB-4FF159,Balambu ma mero 3.1 aana dachin mohoda singal moho,"F105, Chandragiri, Chandragiri Municipality, Kathmandu",Kathmandu,Chandragiri,13-20 Ft,32.0,3.0,3200000.0,9600000.0,False,False,False,False
HB-B2F88F,सस्तोमा भक्तपुर सिपाडोल मेन रोड टच जग्गा बिक्रीमा,"Sipadol Planning, Suryabinayak-8, Bhaktapur",Bhaktapur,Sipadol Planning,Above 20 Ft,1850000.0,9.5,1850000.0,17575000.0,False,False,False,False
HB-149C86,Land for Sale in New Naikap,"New Naikap Health Post, Chandragiri-14, Kathmandu",Kathmandu,New Naikap Health Post,,4500000.0,6.0,4500000.0,27000000.0,False,False,False,False
HB-CD29C7,"Attractive Land for sale in Bisalnagar,Hadigoun","Bishalnagar, Handigaun Marg, Kathmandu-5, Kathmandu, Bagmati Pradesh",Kathmandu,Bishalnagar,9-12 Ft,7500000.0,6.0,1250000.0,7500000.0,False,False,False,False
HB-250F5C,Bhaktapur Sirutar 11 Ana Residential Land,"Sirutar, Suryabinayak, Suryabinayak Municipality, Bhaktapur",Bhaktapur,Sirutar,13-20 Ft,39600000.0,11.0,3600000.0,39600000.0,False,False,False,False
HB-A2C1EE,Peaceful Residential Land for Sale in Balambu!,"Dig Futsal, Chandragiri-12, Kathmandu",Kathmandu,Dig Futsal,,3300000.0,3.25,1015384.6153846154,3300000.0,False,False,False,False
HB-C9E3D0,4 ana land for sale in golfutar,"Golphutar, गोल्फुटार आवासीय सडक, Budhanilakantha-8, Kathmandu, Bagmati Pradesh",Kathmandu,Golphutar,,6500000.0,4.0,1625000.0,6500000.0,False,False,False,False
HB-8A21AC,Land for sale,"Sano Bharyang, Nagarjun-2, Kathmandu, Bagmati Pradesh",Kathmandu,Sano Bharyang,13-20 Ft,24900000.0,5.0,4980000.0,24900000.0,False,False,False,False
HB-804017,मात्र 35 लाखले ३.५ आना जग्गा कपन हाइटमा ।,"बूढानीलकण्ठ, बूढानीलकण्ठ नगरपालिका, काठमाडौं जिल्ला",Kathmandu,बूढानीलकण्ठ,13-20 Ft,3500000.0,3.0,1166666.6666666667,3500000.0,False,False,False,False
HB-81E72C,8 Aana Land On Sale Near Ganesh Chowk Budhanilkant,"Samudaik Marg, बूढानीलकण्ठ, बूढानीलकण्ठ नगरपालिका, काठमाडौं जिल्ला",Kathmandu,बूढानीलकण्ठ,13-20 Ft,5600000.0,8.0,5600000.0,44800000.0,False,False,False,False
HB-9C58F6,"Land for Sale at Gajurel Danda, Mulpani","Gajurel Hill गजुरेल डाँडा, Kageshwori Manahora-6, Kathmandu",Kathmandu,Gajurel Hill गजुरेल डाँडा,Pitched Road,45.0,4.0,4500000.0,18000000.0,False,False,False,False
HB-8701A2,Land for Sale in Nakhipot – Near Kantipur Colony!,"Nakhipot, Lalitpur-14, Lalitpur",Lalitpur,Nakhipot,Pitched Road,12000000.0,4.0,3000000.0,12000000.0,False,False,False,False
HB-560911,Land on sale at Sainbu Bhaisepati,"Bhaisepati, Lalitpur, Lalitpur-18, Lalitpur",Lalitpur,Bhaisepati,Pitched Road,4500000.0,4.0,1125000.0,4500000.0,False,False,False,False
HB-E8766F,Land on sale at Nagarjun,"Nagarjun, Nagarjun-10, Kathmandu",Kathmandu,Nagarjun,Pitched Road,1400000.0,3.5,1400000.0,4900000.0,False,False,False,False
HB-D6D4C2,BHAISIPATI – 16 ANA LAND FOR SALE,"Bhaisipati, Lalitpur-25, Lalitpur",Lalitpur,Bhaisepati,Pitched Road,11500000.0,16.0,11500000.0,184000000.0,False,False,False,False
HB-1B613D,south faced 4 aana land for sale at Sanagaun,"Siddhipur, Mahalaxmi-6, Lalitpur, Bagmati Pradesh",Lalitpur,Siddhipur,13-20 Ft,3800000.0,4.0,3800000.0,15200000.0,False,False,False,False
